{
  "formatVersion": 3,
  "manifest": {
    "id": "app.ai",
    "name": "AI 助手",
    "version": "1.5.1",
    "hostApi": "^1.31.0",
    "dataVersion": 1,
    "permissions": [
      "ui",
      "http",
      "secrets",
      "grants.request",
      "grants.revoke",
      "packages.prepare",
      "packages.review",
      "clock.today"
    ],
    "dependencies": [],
    "defaultInstall": true,
    "httpOrigins": [],
    "description": "提供 AI 助手入口和宿主服务接口。",
    "author": "JayConstruct"
  },
  "entryPoint": "main.js",
  "collections": [
    {
      "id": "connections",
      "schema": {
        "type": "object",
        "required": [
          "id"
        ],
        "properties": {
          "id": {
            "type": "string"
          }
        }
      },
      "configuration": true
    },
    {
      "id": "history",
      "schema": {
        "type": "object",
        "required": [
          "id"
        ],
        "properties": {
          "id": {
            "type": "string"
          }
        }
      }
    },
    {
      "id": "preferences",
      "schema": {
        "type": "object",
        "required": [
          "id",
          "advanced"
        ],
        "properties": {
          "id": {
            "type": "string"
          },
          "advanced": {
            "type": "boolean"
          }
        }
      },
      "configuration": true
    }
  ],
  "services": [
    {
      "id": "ai.connection.save",
      "major": 1,
      "handler": "saveConnection",
      "kind": "command",
      "input": {
        "type": "object"
      },
      "output": {
        "type": "object"
      }
    },
    {
      "id": "ai.history.save",
      "major": 1,
      "handler": "saveHistory",
      "kind": "command",
      "input": {
        "type": "object"
      },
      "output": {
        "type": "object"
      }
    },
    {
      "id": "ai.preferences.save",
      "major": 1,
      "handler": "savePreferences",
      "kind": "command",
      "input": {
        "type": "object",
        "required": [
          "advanced"
        ],
        "properties": {
          "advanced": {
            "type": "boolean"
          }
        },
        "additionalProperties": false
      },
      "output": {
        "type": "object"
      }
    }
  ],
  "pages": [
    {
      "id": "app.ai.page",
      "title": "AI 助手",
      "icon": "ai",
      "handler": "render",
      "entry": {
        "id": "app.ai.entry",
        "opening": "adaptivePanel",
        "placement": "hidden"
      }
    },
    {
      "id": "app.ai.settings",
      "title": "AI 设置",
      "icon": "ai",
      "handler": "renderSettings",
      "headerMode": "contributed",
      "entry": {
        "id": "app.ai.settings.entry",
        "label": "AI 助手",
        "opening": "detail",
        "placement": "settings"
      }
    }
  ],
  "interruptHandlers": [
    "cancel"
  ],
  "contributions": [
    {
      "id": "app.ai.launcher",
      "slot": "workspaceAssistant",
      "handler": "render",
      "label": "AI 助手"
    }
  ]
}
