{
  "formatVersion": 3,
  "manifest": {
    "id": "app.import.shiguang",
    "name": "拾光教务导入兼容",
    "version": "1.7.2",
    "hostApi": "^1.33.0",
    "dataVersion": 1,
    "permissions": [
      "ui",
      "files",
      "browser.capture",
      "services.query:app.schedule/schedule.query.timetables@1",
      "services.command:app.schedule/schedule.import.prepare@1",
      "clock.today"
    ],
    "dependencies": [
      {
        "moduleId": "app.schedule",
        "version": "^1.15.0"
      }
    ],
    "description": "按学校或通用教务系统导入课程，提供脚本说明、源码与致谢，预览确认后保存课表。",
    "author": "JayConstruct"
  },
  "entryPoint": "main.js",
  "collections": [],
  "services": [
    {
      "id": "shiguang.bridge.compile",
      "major": 1,
      "kind": "query",
      "handler": "compileBridge",
      "input": {
        "type": "object",
        "required": [
          "script"
        ],
        "properties": {
          "script": {
            "type": "string"
          },
          "bridgeVersion": {
            "type": "integer",
            "enum": [
              1
            ]
          }
        }
      },
      "output": {
        "type": "object",
        "required": [
          "script",
          "bridgeVersion"
        ],
        "properties": {
          "script": {
            "type": "string"
          },
          "bridgeVersion": {
            "type": "integer",
            "enum": [
              1
            ]
          }
        }
      }
    },
    {
      "id": "shiguang.convert",
      "major": 1,
      "kind": "query",
      "handler": "convert",
      "input": {
        "type": "object"
      },
      "output": {
        "type": "object"
      }
    },
    {
      "id": "shiguang.adapters.list",
      "major": 1,
      "kind": "query",
      "handler": "listAdapters",
      "input": {
        "type": "object",
        "properties": {
          "search": {
            "type": "string"
          },
          "page": {
            "type": "integer",
            "minimum": 0
          },
          "kind": {
            "type": "string",
            "enum": [
              "all",
              "school",
              "general"
            ]
          }
        }
      },
      "output": {
        "type": "object"
      }
    }
  ],
  "pages": [
    {
      "id": "app.import.shiguang.home",
      "title": "拾光教务导入",
      "icon": "calendar",
      "handler": "render",
      "headerMode": "contributed",
      "retainPosition": true,
      "entries": [
        {
          "id": "app.import.shiguang.settings",
          "opening": "detail",
          "placement": "settings"
        },
        {
          "id": "app.import.shiguang.importer",
          "opening": "detail",
          "placement": "page",
          "targetPageId": "app.schedule.imports",
          "slotId": "importers"
        }
      ]
    }
  ]
}
